<?xml version="1.0" encoding="UTF-8" standalone="yes"?><?xml-stylesheet type='text/xsl' href='chatStyle.xsl'?><chat xmlns:xsi="http://www.w3.org/2001/XMLSchema-instance" xsi:noNamespaceSchemaLocation="chatSchema.xsd"><users><chatCreatorClient><email>t@t.com</email><userName>israa</userName></chatCreatorClient><otherClient><email>a@gmail.com</email></otherClient></users><messages><msg><from>a@gmail.com</from><to>t@t.com</to><date>2017/02/20 10:58:14</date><body>hi</body><color>#000000</color><font>Times New Roman</font><size></size></msg><msg><from>a@gmail.com</from><to>t@t.com</to><date>2017/02/20 10:59:18</date><body>chj</body><color>#000000</color><font>Times New Roman</font><size></size></msg><msg><from>t@t.com</from><to>a@gmail.com</to><date>2017/02/20 10:59:26</date><body>dfgh</body><color>#000000</color><font>Times New Roman</font><size></size></msg></messages></chat>