<?xml version="1.0" encoding="UTF-8" standalone="yes"?><?xml-stylesheet type='text/xsl' href='chatStyle.xsl'?><chat xmlns:xsi="http://www.w3.org/2001/XMLSchema-instance" xsi:noNamespaceSchemaLocation="chatSchema.xsd"><users><chatCreatorClient><email>a@gmail.com</email><userName>israa</userName></chatCreatorClient><otherClient><email>t@t.com</email></otherClient></users><messages><msg><from>a@gmail.com</from><to>t@t.com</to><date>2017/02/19 12:06:00</date><body>huhjhdsjkhjf</body><color>#000000</color><font>Times New Roman</font><size></size></msg><msg><from>a@gmail.com</from><to>t@t.com</to><date>2017/02/19 12:06:18</date><body>asdff</body><color>#000000</color><font>Times New Roman</font><size></size></msg></messages></chat>