<?xml version="1.0" encoding="UTF-8" standalone="yes"?><?xml-stylesheet type='text/xsl' href='chatStyle.xsl'?><chat xmlns:xsi="http://www.w3.org/2001/XMLSchema-instance" xsi:noNamespaceSchemaLocation="chatSchema.xsd"><users><chatCreatorClient><email>t@t.com</email><userName>israa</userName></chatCreatorClient><otherClient><email>m@gmail.com</email></otherClient></users><messages><msg><from>m@gmail.com</from><to>t@t.com</to><date>2017/02/19 01:22:14</date><body>wer</body><color>#000000</color><font>Times New Roman</font><size></size></msg><msg><from>m@gmail.com</from><to>t@t.com</to><date>2017/02/19 01:22:26</date><body>wef</body><color>#000000</color><font>Verdana</font><size>40</size></msg><msg><from>t@t.com</from><to>m@gmail.com</to><date>2017/02/19 01:22:31</date><body>fd</body><color>#000000</color><font>Times New Roman</font><size></size></msg><msg><from>t@t.com</from><to>m@gmail.com</to><date>2017/02/19 01:22:37</date><body>gfre</body><color>#000000</color><font>Times New Roman</font><size>50</size></msg></messages></chat>