<?xml version="1.0" encoding="UTF-8" standalone="yes"?><?xml-stylesheet type='text/xsl' href='chatStyle.xsl'?><chat xmlns:xsi="http://www.w3.org/2001/XMLSchema-instance" xsi:noNamespaceSchemaLocation="chatSchema.xsd"><users><chatCreatorClient><email>m@gmail.com</email><userName>israa</userName></chatCreatorClient><otherClient><email>t@t.com</email></otherClient></users><messages><msg><from>m@gmail.com</from><to>t@t.com</to><date>2017/02/19 00:30:25</date><body>hi toqa</body><color>#000000</color><font>Times New Roman</font><size></size></msg><msg><from>t@t.com</from><to>m@gmail.com</to><date>2017/02/19 00:30:39</date><body>hello m </body><color>#B36680</color><font>Times New Roman</font><size></size></msg><msg><from>m@gmail.com</from><to>t@t.com</to><date>2017/02/19 00:31:05</date><body>how is your project</body><color>#B31A1A</color><font>Lucida Console</font><size>10</size></msg><msg><from>m@gmail.com</from><to>t@t.com</to><date>2017/02/19 00:31:26</date><body>I am testing it right now </body><color>#B31A1A</color><font>Lucida Console</font><size>40</size></msg></messages></chat>