<?xml version="1.0" encoding="UTF-8" standalone="yes"?><?xml-stylesheet type='text/xsl' href='chatStyle.xsl'?><chat xmlns:xsi="http://www.w3.org/2001/XMLSchema-instance" xsi:noNamespaceSchemaLocation="chatSchema.xsd"><users><chatCreatorClient><email>t@t.com</email><userName>israa</userName></chatCreatorClient><otherClient><email>s@s.com</email></otherClient></users><messages><msg><from>t@t.com</from><to>s@s.com</to><date>2017/02/19 12:57:23</date><body>12345</body><color>#000000</color><font>Times New Roman</font><size></size></msg><msg><from>s@s.com</from><to>t@t.com</to><date>2017/02/19 12:56:43</date><body>po9opo</body><color>#000000</color><font>Times New Roman</font><size></size></msg></messages></chat>