<?xml version="1.0" encoding="UTF-8" standalone="yes"?><?xml-stylesheet type='text/xsl' href='chatStyle.xsl'?><chat xmlns:xsi="http://www.w3.org/2001/XMLSchema-instance" xsi:noNamespaceSchemaLocation="chatSchema.xsd"><users><chatCreatorClient><email>toqa@s7s.com</email><userName>israa</userName></chatCreatorClient><otherClient><email>bebetoo@s7s.com</email></otherClient></users><messages><msg><from>toqa@s7s.com</from><to>bebetoo@s7s.com</to><date>2017/02/19 12:24:50</date><body>1234</body><color>#000000</color><font>Times New Roman</font><size></size></msg><msg><from>bebetoo@s7s.com</from><to>toqa@s7s.com</to><date>2017/02/19 12:24:24</date><body>888888888888888</body><color>#000000</color><font>Times New Roman</font><size></size></msg></messages></chat>